{
  "$schema": "https://json-schema.org/draft/2020-12/schema",
  "$id": "https://tutor-guardian.local/schemas/curriculum/lesson.schema.json",
  "title": "Curriculum Lesson",
  "description": "درس واحد داخل مسار تربوي. الدرس يجمع عدة knowledge units من knowledge_base/units/ ويقدّمها للوالد في قصة مترابطة مع try_this عملي. ملاحظة: قيم enum تطابق backend/app/core/taxonomy.py.",
  "type": "object",
  "additionalProperties": false,
  "required": [
    "id",
    "path_id",
    "title",
    "age_group",
    "domain",
    "unit_ids",
    "summary",
    "try_this",
    "order"
  ],
  "properties": {
    "id": {
      "type": "string",
      "pattern": "^lesson_[a-z0-9_\\-]{3,80}$",
      "description": "معرّف الدرس الفريد. النمط: lesson_<path_slug>_<order>. مثال: lesson_4-6_islamic_parenting_bond_01."
    },
    "path_id": {
      "type": "string",
      "pattern": "^path_[a-z0-9_\\-]{3,80}$",
      "description": "المسار الأب. يجب أن يطابق ملف path.json موجود في knowledge_base/curriculum/paths/."
    },
    "title": {
      "type": "string",
      "minLength": 3,
      "maxLength": 120,
      "description": "عنوان الدرس بالعربية الفصحى."
    },
    "age_group": {
      "type": "string",
      "enum": [
        "0-3",
        "10-12",
        "13-15",
        "16-18",
        "2-3",
        "4-6",
        "7-9",
        "prenatal-1",
        "unspecified"
      ],
      "description": "الفئة العمرية. يجب أن يطابق المسار الأب."
    },
    "domain": {
      "type": "string",
      "enum": [
        "aqeedah",
        "cyber",
        "development",
        "islamic_parenting",
        "medical",
        "infant_pregnancy"
      ],
      "description": "المجال. يجب أن يطابق المسار الأب."
    },
    "unit_ids": {
      "type": "array",
      "minItems": 0,
      "maxItems": 14,
      "items": {
        "type": "string",
        "format": "uuid"
      },
      "description": "قائمة معرّفات knowledge units (من knowledge_base/units/*.json). كل unit يُحقق من unit.age_group/unit.domain موافق للدرس. حد أقصى 10 وحدات للقراءة في ≤ 5 دقائق."
    },
    "summary": {
      "type": "string",
      "minLength": 30,
      "maxLength": 2500,
      "description": "ملخص الدرس من 3-6 جمل يشرح الفكرة الرئيسية ولماذا تهم هذه الفئة العمرية."
    },
    "try_this": {
      "type": "string",
      "minLength": 20,
      "maxLength": 1500,
      "description": "إجراء عملي قابل للتطبيق هذا الأسبوع، مثال: 'اجلس مع طفلك 5 دقائق قبل النوم واسأله: ما أجمل شيء حدث اليوم؟'."
    },
    "order": {
      "type": "integer",
      "minimum": 1,
      "maximum": 30,
      "description": "ترتيب الدرس داخل المسار (1 = أول درس). يجب أن يكون فريداً داخل المسار."
    },
    "estimated_minutes": {
      "type": "integer",
      "minimum": 3,
      "maximum": 60,
      "default": 5,
      "description": "الوقت الإرشادي لإكمال الدرس بالدقائق. تنبيه: ≤ 15 دقيقة لاحترام وقت الوالد (مبدأ الزهد في الطول)."
    },
    "reflection_prompts": {
      "type": "array",
      "maxItems": 3,
      "items": {
        "type": "string",
        "minLength": 10,
        "maxLength": 200
      },
      "default": [],
      "description": "أسئلة تأملية قصيرة (≤ 3) يطرحها الـ app على الوالد بعد الدرس، مثل: 'ما الذي فاجأك في رد فعل طفلك؟'."
    },
    "warning_flags": {
      "type": "array",
      "items": {
        "type": "string",
        "minLength": 3
      },
      "description": "تحذيرات تستدعي انتباه الوالد. **نصّ حرّ لا مفردات محكومة** — المخطّط كان يعرّف ثلاث قيم بينما البيانات تحمل نحو ثمانين تحذيرًا إكلينيكيًّا مكتوبًا («أفكار انتحار/خطة»، «إيذاء ذاتي»). الممارسة حسمت الأمر، فالوصف يتبعها."
    },
    "is_published": {
      "type": "boolean",
      "default": false
    },
    "version": {
      "type": "string",
      "pattern": "^\\d+\\.\\d+\\.\\d+$"
    },
    "created_at": {
      "type": "string",
      "format": "date-time"
    },
    "updated_at": {
      "type": "string",
      "format": "date-time"
    },
    "approved_by": {
      "type": [
        "string",
        "null"
      ],
      "description": "من أجاز هذا المحتوى. في ملفات i18n/en: إما اسم مراجِع بشري، وإما ختم المراجعة الآلية `auto-review:<مراجع A>+<مراجع B>:<YYYY-MM-DD>` الذي يكتبه ops/tools/review_en_parity.py بعد أن تمرّ الحرّاس الحتمية ولا يجد مراجعان من عائلتَي نماذج مختلفتين عيبًا متوسطًا أو عاليًا في النص بعينه (بصمته في translation.auto_review.content_sha256). الختم الآلي ليس إجازة شرعية ولا يدّعيها. null = لم يجتز البوابة، لا يُنشر للإنجليزية (يرفضه pre-commit).",
      "default": null
    },
    "language": {
      "type": "string",
      "description": "لغة هذا الملف. غيابه = العربية (لغة المصدر). الترجمات في i18n/<lang>/."
    },
    "source_language": {
      "type": "string",
      "description": "اللغة التي تُرجم عنها هذا الملف. للمصدر العربي: غير موجود."
    },
    "translation": {
      "type": "object",
      "description": "سجل الترجمة والمراجعة. تكتبه ops/tools/translate_curriculum.py، ويختمه ops/tools/review_en_parity.py (approved_by + auto_review) بعد المراجعة الآلية المزدوجة.",
      "properties": {
        "translator_model": {
          "type": [
            "string",
            "null"
          ]
        },
        "reviewer_model": {
          "type": [
            "string",
            "null"
          ]
        },
        "needs_scholar_review": {
          "type": "boolean"
        },
        "scholar_signals": {
          "type": "object"
        },
        "review_verdict": {
          "type": "string",
          "enum": [
            "clean",
            "defects",
            "pending",
            "unreviewed"
          ]
        },
        "review_defects": {
          "type": "array",
          "items": {
            "type": "object"
          }
        },
        "revalidated_at": {
          "type": "string",
          "description": "متى أُعيد الحكم على النص الحالي. غيابه = السجل قد يصف نصًّا أُصلح بعده."
        },
        "approved_by": {
          "type": [
            "string",
            "null"
          ],
          "description": "نفس قيمة approved_by في الجذر: اسم مراجِع بشري أو ختم auto-review:<A>+<B>:<date>. null = غير مراجَع."
        }
      },
      "additionalProperties": true
    },
    "needs_professional_followup": {
      "type": [
        "boolean",
        "null"
      ],
      "description": "هل يستدعي هذا الدرس إحالة لمختصّ. موجود في 123 درسًا ولم يكن معرَّفًا."
    }
  }
}
