{
  "id": "lesson_2-3_development_tantrums_06",
  "path_id": "path_2-3_development_tantrums",
  "title": "خياران بدل أمرٍ واحد",
  "age_group": "2-3",
  "domain": "development",
  "unit_ids": [
    "seed-tantrum-23",
    "dev-35865ddb"
  ],
  "summary": "رأيت في الدرس السابق أن «لا» المتكرّرة جزءٌ من نموّ استقلال طفلك. واليوم أداةٌ بسيطة قد تساعدك: أن تعطيه شيئًا من التحكّم في الأمور الصغيرة، بخيارين كلاهما مقبولٌ لك، بدلًا من سؤالٍ جوابه نعم أو لا، أو أمرٍ مجرّد. فبدلًا من «البس هذا القميص» قل: «هل تلبس الأزرق أم الأحمر؟». ما تريده يحدث في الحالتين، لكنه يشعر أن له رأيًا فيه. أمّا في الطعام فلا تجعل الخيارين وسيلةً لإجباره على الأكل: دورك أن تقدّم له طعامًا صحيًّا يناسب عمره، ودوره أن يقرّر هل يأكل منه وكم يأكل. وإن رفض طعامًا فلا تجبره، وقدّمه له مرةً أخرى في وقتٍ آخر. وانظر إلى ما يأكله خلال الأسبوع، لا في وجبةٍ واحدة؛ فإن كان نشيطًا ويزداد وزنه ويبدو بخير، فهو يأكل ما يكفيه.\n\nوللخيارات قواعد بسيطة: أن يكون الخياران مقبولين لك فعلًا، فلا تعرض خيارًا لن تنفّذه. وأن يكونا صغيرين واضحين يفهمهما في عمره. وألّا تعرض خيارًا فيما يمسّ سلامته، كربطه في مقعد السيارة الخاص به في كلّ مرة؛ هنا تقول القاعدة بهدوء وتنفّذها، ويمكنك أن تعطيه خيارًا في أمرٍ آخر، كاللعبة التي يحملها في الطريق.\n\nوأخبره قبل التغيير بما سيحدث، ثم اعرض الخيارين: «سنقرأ قصةً ثم ننام. أيّ القصّتين تريد؟».\n\nوإن لم يختر أيًّا منهما، فانظر أولًا: هل هو متعب أو جائع أو متألم أو مريض، أو منزعج من شيء؟ فإن ظهرت حاجةٌ فلبِّها. وإلا فاختر أنت بهدوء: «سأختار الأزرق اليوم»، ونفّذ ما قلته دون نقاشٍ طويل، ودون صراخٍ أو تهديد. ولا تعرض عليه حلوى ليختار؛ فهذه رشوة.\n\nوحين يختار ويتعاون، فامدحه بكلامٍ محدّد: «اخترتَ القميص الأزرق ولبسته!». والخيارات قد تساعده على التعاون، لكنها لا تمنع كلّ رفضٍ أو نوبة؛ فإن جاءت النوبة، فعد إلى الأمان والهدوء أولًا.\n\nوتحدّث مع طبيب الأطفال إن كانت النوبات كثيرةً جدًّا أو أطول ممّا يُتوقّع في عمره، أو كان لا يستطيع أن يهدأ، أو يؤذي نفسه أو غيره، أو كانت تعطّل حياته اليومية، أو فقد مهاراتٍ كان يتقنها، أو بدا منسحبًا أو حزينًا أو كثيرَ المطالب لا يرضى في أغلب الأوقات. وإن حدثت إصابةٌ خطيرة أو لم تستطع الحفاظ على سلامته، فاطلب مساعدةً عاجلة فورًا.",
  "try_this": "اليوم: في موقفٍ واحد من يوم طفلك، كاللبس أو اختيار القصة، قدّم له خيارين مقبولين لك بدلًا من الأمر المباشر، ولاحظ كيف يستجيب.",
  "order": 6,
  "estimated_minutes": 3,
  "reflection_prompts": [
    "في أيّ موقفٍ ساعدت الخيارات طفلك، وماذا فعلت حين لم يختر أيًّا منهما؟"
  ],
  "warning_flags": [],
  "needs_professional_followup": false,
  "is_published": true,
  "version": "1.0.0",
  "created_at": "2026-10-08T08:43:40",
  "updated_at": "2026-10-08T18:00:00",
  "approved_by": null
}
