{
  "id": "lesson_16-18_development_adult_readiness_03",
  "path_id": "path_16-18_development_adult_readiness",
  "title": "Mental Health and the Pressure of the Future: Anxiety About Tomorrow",
  "age_group": "16-18",
  "domain": "development",
  "unit_ids": [],
  "summary": "The pressure of high school, university admissions, and comparisons can weigh heavily on your young one. Natural anxiety drives him to work, but persistent sadness, isolation, or loss of enjoyment in everything for more than two weeks are signs not to be ignored. Be a source of security, not additional pressure, and ask about his feelings, not just his grades.",
  "try_this": "This week: Set aside a quiet session where you ask your son, \"How are *you*?\" not \"How are your studies?\" and listen without offering immediate solutions.",
  "order": 3,
  "estimated_minutes": 7,
  "reflection_prompts": [
    "What does your son’s general mood look like these days?",
    "Does he find security with you to speak about his pressures?"
  ],
  "warning_flags": [
    "حزن أو قلق يومي أكثر من أسبوعين",
    "عزلة وانسحاب اجتماعي",
    "فقدان المتعة أو حديث عن العدم"
  ],
  "needs_professional_followup": true,
  "is_published": true,
  "version": "1.0.0",
  "approved_by": "auto-review:deepseek-v4-pro+glm-5.2:2026-10-04",
  "language": "en",
  "source_language": "ar",
  "translation": {
    "translator_model": "mistral-large-3:675b",
    "reviewer_model": "deepseek-v4-pro+glm-5.2",
    "needs_scholar_review": true,
    "scholar_signals": {
      "keyword": false,
      "quoted_arabic": true,
      "reviewer_model": false
    },
    "review_verdict": "clean",
    "review_defects": [],
    "approved_by": "auto-review:deepseek-v4-pro+glm-5.2:2026-10-04",
    "revalidated_at": "2026-10-04T11:18:18+00:00",
    "auto_review": {
      "reviewers": [
        "deepseek-v4-pro",
        "glm-5.2"
      ],
      "fixer": null,
      "rounds": 1,
      "prompt_version": "dfa8a5f39718",
      "content_sha256": "777a9058e56257761538bb16a9baf1b9de97e834b2151d74f564394f54d37c24",
      "reviewed_at": "2026-10-04T11:18:18+00:00",
      "residual_low": [],
      "adjudicated": [],
      "tool": "ops/tools/review_en_parity.py",
      "meaning": "deterministic guards passed and two different-family model reviewers found no medium/high defect in this exact text; not a scholar's ijazah"
    }
  }
}
