{
  "id": "lesson_16-18_islamic_parenting_adult_faith_02",
  "path_id": "path_16-18_islamic_parenting_adult_faith",
  "title": "العفّة والاستعداد للزواج: حوارٌ صريحٌ بلا خجل",
  "age_group": "16-18",
  "domain": "islamic_parenting",
  "unit_ids": [],
  "summary": "في هذا السن تشتدّ الغريزة وتكثر المغريات، وصمتك لا يحميه بل يتركه فريسةً لمصادر مشوّهة. تحدّث معه بوقارٍ وصراحة عن العفّة، وحدود العلاقات، وقيمة الزواج كسكنٍ وإحصان، وأعِنه على ضبط نفسه بالصوم والرياضة والانشغال النافع. حياؤك من الحوار يدفعه لمصادر أسوأ.",
  "try_this": "هذا الأسبوع: افتح حواراً هادئاً (لا محاضرة) حول سؤالٍ يخصّ العلاقات أو الزواج، واسمع رأيه أولاً قبل أن توجّه، وأخبره أن بابك مفتوح لأي سؤال.",
  "order": 2,
  "estimated_minutes": 7,
  "reflection_prompts": [
    "هل يشعر ابنك أنه يستطيع سؤالك بصراحة في هذه الأمور؟",
    "ما القيمة العملية التي رسّختها معه هذا الأسبوع؟"
  ],
  "warning_flags": [
    "علاقة محرّمة قائمة أو سلوك خطر",
    "إدمان محتوى إباحي"
  ],
  "needs_professional_followup": true,
  "is_published": true,
  "version": "1.0.0",
  "approved_by": null
}
