{
  "id": "lesson_4-6_aqeedah_seeds_01",
  "path_id": "path_4-6_aqeedah_seeds",
  "title": "الله ربي وخالقي",
  "age_group": "4-6",
  "domain": "aqeedah",
  "unit_ids": [],
  "summary": "في هذه السنّ يتعلّم الطفل بالمحسوسات. عرّفيه بالله من خلال ما يراه: «من خلق العصفور الذي يطير؟ من خلق القمر؟ من خلق ماما وبابا؟ — الله». كرّري الجملة المحبَّبة «الله خلقنا، والله كريم». لا تُدخلي تفاصيل مجرّدة؛ يكفي أن يربط الطفل كل شيءٍ جميلٍ بأن الله خالقه، فتُغرَس أول بذرةٍ في قلبه: أن له ربّاً عظيماً خلق كل شيء.",
  "try_this": "هذا الأسبوع: العبي مع طفلك لعبة «من خلق هذا؟» — تشيرين لشيء جميل ويجيب «الله»، ثم تقولان معاً «الله أكبر».",
  "order": 1,
  "estimated_minutes": 8,
  "reflection_prompts": [
    "كيف تستغلّين فضول طفلك بالأشياء من حوله لتعريفه بالله الخالق؟",
    "ما الجملة الإيمانية البسيطة التي تحبّين أن يردّدها طفلك يومياً؟"
  ],
  "warning_flags": [],
  "needs_professional_followup": false,
  "is_published": true,
  "version": "1.0.0",
  "approved_by": null
}
