{
  "id": "lesson_13-15_medical_mental_health_01",
  "path_id": "path_13-15_medical_mental_health",
  "title": "Depression and Anxiety in Adolescents: Not a Mood, but an Illness",
  "age_group": "13-15",
  "domain": "medical",
  "unit_ids": [
    "926b70f3-1ad1-42f7-9d51-c294143bcbd0",
    "92b2c72a-77e1-4f1b-8245-c8b347d4eb73",
    "b3b05246-1471-4374-bad2-200c2e33a3d2",
    "b7bd9ca3-382c-40b2-8829-8175379be248",
    "9816082f-6564-42fd-a37b-5b38083a94a8",
    "ca67a271-881f-419a-825a-5cbd7e219227",
    "e93bb1b3-277f-4b93-b530-9946896fd1e0",
    "a77834fd-ec17-4e0f-b98d-048e87c44bdb"
  ],
  "summary": "Teenage depression: sadness/emptiness > two weeks, loss of enjoyment, fatigue, changes in sleep/appetite, poor concentration, negative thoughts. Anxiety: persistent tension, expecting disaster, avoiding situations. It is not a \"mood\" or \"weakness of iman\" — it is a chemical/psychological imbalance. Treatment: Cognitive Behavioral Therapy (CBT) + medication if needed + family support. Parents: listen without judgment, reassure: \"It is an illness like any other, and it has a cure.\"",
  "try_this": "This week: the simplified PHQ-9 (mood) and GAD-7 (anxiety) questionnaires — complete it with your child confidentially. If the score is >10: schedule an appointment with a pediatrician or mental health specialist.",
  "order": 1,
  "estimated_minutes": 15,
  "reflection_prompts": [
    "What was the highest score on the scale?",
    "Did your child feel at ease after the conversation?"
  ],
  "warning_flags": [
    "أفكار إيذاء ذاتي/انتحار",
    "عزلة تامة >أسبوع",
    "تراجع دراسي حاد"
  ],
  "needs_professional_followup": true,
  "is_published": true,
  "version": "1.0.0",
  "approved_by": null,
  "language": "en",
  "source_language": "ar",
  "translation": {
    "translator_model": "mistral-large-3:675b",
    "reviewer_model": "deepseek-v4-pro",
    "needs_scholar_review": true,
    "scholar_signals": {
      "keyword": true,
      "quoted_arabic": true,
      "reviewer_model": false
    },
    "review_verdict": "defects",
    "review_defects": [
      {
        "type": "meaning_change",
        "field": "summary",
        "arabic": "مرض كأي مرض، له علاج",
        "english": "It is an illness like any other, and it has a cure.",
        "why": "The Arabic 'علاج' means 'treatment', not 'cure'. 'Cure' implies complete resolution, which is not always accurate for depression and may set unrealistic expectations.",
        "severity": "low"
      }
    ],
    "approved_by": null,
    "revalidated_at": "2026-08-13T17:23:17.319164+00:00",
    "manual_fix_note": "2026-10-04: aligned with the Arabic register/safety fix (country-specific number removed, leaked or garbled wording corrected).",
    "fixed_at": "2026-10-04T07:31:52.180297+00:00",
    "fixer_model": "claude-opus-5.5"
  }
}
