{
  "id": "lesson_13-15_islamic_parenting_teen_identity_03",
  "path_id": "path_13-15_islamic_parenting_teen_identity",
  "title": "الزواج المستقبلي: اختيار الشريك، الحقوق، وبناء الأسرة",
  "age_group": "13-15",
  "domain": "islamic_parenting",
  "unit_ids": [
    "isl-7365e833",
    "isl-83d7099a",
    "isl-cc4ee988"
  ],
  "summary": "في سن 13-15 يبدأ التفكير في الزواج. لا تبكر بالنقاش لكن لا تؤخر: اختر الشريك على الدين/الخلق، تعرف على الحقوق المتبادلة (نفقة، مودة، سكينة)، وابنِ من الآن مهارات: حوار، تسامح، تحمل مسؤولية.",
  "try_this": "هذا الأسبوع: ناقشا سيناريو: \"لو اخترت شريك حياتك، ما أهم 3 صفات تبحث عنها؟\" — استمعا دون حكم، وجهوا للمعايير الشرعية.",
  "order": 3,
  "estimated_minutes": 31,
  "reflection_prompts": [
    "ما الصفات التي ذكرها ابنك؟",
    "هل فهم الفرق بين الحب والشهوة؟"
  ],
  "warning_flags": [
    "علاقات عاطفية سابقة غير مشروعة",
    "مفاهيم خاطئة عن الزواج من وسائل التواصل"
  ],
  "needs_professional_followup": true,
  "is_published": true,
  "version": "1.0.0",
  "approved_by": null
}
