{
  "id": "lesson_4-6_medical_healthy_growth_01",
  "path_id": "path_4-6_medical_healthy_growth",
  "title": "النوم الكافي: كم يحتاج طفلك ولماذا",
  "age_group": "4-6",
  "domain": "medical",
  "unit_ids": [],
  "summary": "يحتاج الطفل في هذا السن من 10 إلى 13 ساعة نومٍ يومياً (مع القيلولة). قلّة النوم تؤثّر في المزاج والانتباه والمناعة. ثبّت موعد نومٍ منتظماً، وامنع الشاشات قبله بساعة، واجعل ما قبل النوم هادئاً: حمّامٌ دافئ وقصة. إذا استمرّت صعوبات النوم رغم الروتين فاستشر الطبيب.",
  "try_this": "هذا الأسبوع: ثبّت موعد نومٍ واحداً كل ليلة، وأنشئ روتيناً هادئاً قبله بنصف ساعة بلا شاشات.",
  "order": 1,
  "estimated_minutes": 6,
  "reflection_prompts": [
    "كم ساعة ينام طفلك فعلياً؟",
    "هل لديه روتين نومٍ ثابت؟"
  ],
  "warning_flags": [
    "صعوبات نومٍ شديدة ومستمرة",
    "شخير أو انقطاع نفسٍ أثناء النوم"
  ],
  "needs_professional_followup": true,
  "is_published": true,
  "version": "1.0.0",
  "approved_by": null
}
