{
  "id": "lesson_2-3_development_tantrums_05",
  "path_id": "path_2-3_development_tantrums",
  "title": "«لا» الصغيرة: العناد علامة نموّ",
  "age_group": "2-3",
  "domain": "development",
  "unit_ids": [
    "dev-35865ddb",
    "seed-tantrum-23"
  ],
  "summary": "قد تسمع «لا!» من طفلك في الثانية والثالثة مرّاتٍ كثيرة: عند اللبس، وعند الاستحمام، وعند وقت النوم. وقد يتعبك هذا الرفض، أو تشعر أنه يبتعد عنك، وهذا شعورٌ مفهوم. لكنّ طفلك في هذا العمر يبدأ يُظهر استقلاله، ويختبر الحدود ليعرف ما المسموح وما الممنوع. فالرفض المتكرّر لا يعني أنه طفلٌ سيّئ، ولا أنك أخطأت في تربيته.\n\nوقبل أن تسمّيه عنادًا، انظر إلى حاله: فقد يأتي السلوك الصعب من التعب أو الجوع أو الألم أو بداية مرض، أو من الإحباط أو الملل. فإن ظهرت حاجةٌ فلبِّها أولًا.\n\nثم اجعل الحدود قليلةً وواضحة، واثبت عليها: ما يتعلّق بسلامته، وما يؤذي غيره. واشرح له السبب بكلماتٍ بسيطة، مثل: «أمسِك يدي حين نعبر الشارع لتبقى سالمًا». أمّا الأمور الصغيرة التي لا ضرر فيها، فلا تجعل كلّ واحدةٍ منها معركة، وكن مرنًا حين تستطيع.\n\nوإن كان الأمر لا يحتمل «لا»، فلا تسأله سؤالًا جوابه نعم أو لا. فبدلًا من «هل تريد أن تستحمّ؟» قل بهدوء: «حان وقت الحمّام». ويمكنك أن تجعل ما يرفضه أمتع، كلعبةٍ صغيرة في ماء الحمّام.\n\nواجعل استجابتك واحدةً في كلّ مرة، واتّفق مع من يرعاه على الطريقة نفسها، ونفّذ ما قلته بهدوء. وحين يتعاون، فامدحه بكلامٍ محدّد: «لبستَ حذاءك وحدك!». ولا تُعطه المكافأة قبل أن يفعل ما طلبته، ولا تُعطه حلوى لتُنهي نوبته؛ فهذه رشوةٌ لا مكافأة. أمّا إن اتّفقتما مسبقًا على مكافأةٍ بسيطة لسلوكٍ واضحٍ يناسب عمره، كقصةٍ إضافية أو لعبةٍ معك، فأعطه إياها فور أن يفعله، مع مدحٍ محدّد؛ فهذا تشجيعٌ لا رشوة. ولا تضربه ولا تصرخ عليه ولا تهدّده ولا تُهِنه؛ فالضرب يعلّمه أن الضرب مقبول. وإن شعرت أن غضبك يشتدّ، فخذ أنفاسًا عميقة وأنت قريبٌ منه، أو اطلب من شخصٍ تثق به أن يبقى معه حتى تهدأ، ثم عد إليه.\n\nوتحدّث مع طبيب الأطفال إن كانت النوبات كثيرةً جدًّا أو أطول ممّا يُتوقّع في عمره، أو كان لا يستطيع أن يهدأ، أو يؤذي نفسه أو غيره، أو كانت تعطّل حياته اليومية، أو فقد مهاراتٍ كان يتقنها، أو بدا منسحبًا أو حزينًا أو كثيرَ المطالب لا يرضى في أغلب الأوقات. وإن حدثت إصابةٌ خطيرة أو لم تستطع الحفاظ على سلامته، فاطلب مساعدةً عاجلة فورًا.",
  "try_this": "اليوم: اختر موقفًا واحدًا يقول فيه طفلك «لا» عادةً، وقل فيه جملةً هادئة واضحة بدلًا من السؤال، مثل: «حان وقت الحمّام» بدلًا من «هل تريد أن تستحمّ؟».",
  "order": 5,
  "estimated_minutes": 3,
  "reflection_prompts": [
    "في أيّ أمرٍ يقول طفلك «لا» أكثر، وهل هو أمرٌ يمسّ سلامته فيستحقّ الثبات، أم أمرٌ صغير يحتمل المرونة؟"
  ],
  "warning_flags": [],
  "needs_professional_followup": false,
  "is_published": true,
  "version": "1.0.0",
  "created_at": "2026-10-08T08:43:40",
  "updated_at": "2026-10-08T18:00:00",
  "approved_by": null
}
