{
  "id": "lesson_2-3_islamic_first_words_02",
  "path_id": "path_2-3_islamic_first_words",
  "title": "السلام والكلمة الطيّبة",
  "age_group": "2-3",
  "domain": "islamic_parenting",
  "unit_ids": [],
  "summary": "قال الله تعالى: ﴿وَقُولُوا لِلنَّاسِ حُسْنًا﴾ [سورة البقرة — آية ٨٣]. علّمي طفلك السلام عند الدخول والشكر عند العطاء؛ قال النبي ﷺ: «والكلمة الطيبة صدقة» (صحيح البخاري — حديث ٢٩٨٩)، وغرسها مبكراً يصنع قلباً ولساناً جميلين.",
  "try_this": "اليوم: حين تدخلين البيت، ألقي السلام بصوتٍ واضح، وشجّعي طفلك على أن يقلّدك ويردّ السلام.",
  "order": 2,
  "estimated_minutes": 6,
  "reflection_prompts": [
    "هل بدأ طفلك يلقي السلام؟",
    "كيف تشجّعينه؟"
  ],
  "warning_flags": [],
  "needs_professional_followup": false,
  "is_published": true,
  "version": "1.0.0",
  "approved_by": null
}
