{
  "id": "lesson_0-3_islamic_parenting_attachment_02",
  "path_id": "path_0-3_islamic_parenting_attachment",
  "title": "Rifq and Rahmah: The Prophetic Manner in Caring for the Young Child",
  "age_group": "0-3",
  "domain": "islamic_parenting",
  "unit_ids": [
    "f66f6ba1-d342-47a0-8184-6bfb848c47be"
  ],
  "summary": "Rifq (gentleness) is an authentic Islamic value, not a weakness—Allah’s Messenger ﷺ said: «Indeed, Allah is Rafeeq (Gentle) and loves rifq in every matter» (Sahih al-Bukhari 6927). In the first months, the child does not understand words but senses tone, touch, and presence. Rifq in carrying, softness in handling, patience with crying, and avoiding hitting or harm in any form—these are Prophetic values before they are psychological recommendations. The child treated with rifq learns rifq, and the one threatened with shouting learns fear. You are building the personality day by day with every touch, glance, and word.",
  "try_this": "This week: Observe your tone of voice with your child. When they cry, instead of tensing up—breathe, come close, and speak in a calm, low voice. The child is soothed by the gentle voice before the words. During changing or bathing, talk to them and describe what you are doing: «Now we are dressing you...» Gentle verbal communication in the early months builds trust even before they understand the meaning.",
  "order": 2,
  "estimated_minutes": 46,
  "reflection_prompts": [
    "In which situations do you find it difficult to maintain rifq with your child? And what helps you do so?",
    "How was your parents’ method of tarbiyah (upbringing)? What do you want to preserve or change?"
  ],
  "warning_flags": [],
  "is_published": true,
  "version": "1.0.0",
  "created_at": "2026-06-10T16:00:00",
  "updated_at": "2026-06-10T16:00:00",
  "approved_by": "auto-review:deepseek-v4-pro+glm-5.2:2026-10-04",
  "language": "en",
  "source_language": "ar",
  "translation": {
    "translator_model": "mistral-large-3:675b",
    "reviewer_model": "deepseek-v4-pro+glm-5.2",
    "needs_scholar_review": true,
    "scholar_signals": {
      "keyword": true,
      "quoted_arabic": true,
      "reviewer_model": true
    },
    "review_verdict": "clean",
    "review_defects": [],
    "approved_by": "auto-review:deepseek-v4-pro+glm-5.2:2026-10-04",
    "revalidated_at": "2026-10-04T16:52:31+00:00",
    "fixed_at": "2026-10-04T08:15:36.331649+00:00",
    "fixer_model": "claude-opus-5.5",
    "manual_fix_note": "2026-10-04 scripture fix: hadith quoted only from the Sahihayn with book + number (Muslim by Abd al-Baqi); non-Sahihayn or paraphrased quotes replaced, mirrored from the Arabic.",
    "auto_review": {
      "reviewers": [
        "deepseek-v4-pro",
        "glm-5.2"
      ],
      "fixer": null,
      "rounds": 1,
      "prompt_version": "dfa8a5f39718",
      "content_sha256": "be6366cb1373ed80be516e8f926138ce11160dd6814cfb5a1e3a7c0530bce575",
      "reviewed_at": "2026-10-04T16:52:31+00:00",
      "residual_low": [],
      "adjudicated": [],
      "tool": "ops/tools/review_en_parity.py",
      "meaning": "deterministic guards passed and two different-family model reviewers found no medium/high defect in this exact text; not a scholar's ijazah"
    }
  }
}
