{
  "id": "lesson_10-12_aqeedah_growth_02",
  "path_id": "path_10-12_aqeedah_growth",
  "title": "المراقبة والإخلاص: أعمل لله لا للناس",
  "age_group": "10-12",
  "domain": "aqeedah",
  "unit_ids": [],
  "summary": "مع اقتراب البلوغ يبدأ تأثير نظرة الناس يقوى. ازرع في ابنك «الإخلاص»: أن يعمل الخير لأن الله يراه ويرضى، لا ليراه الناس ويمدحوه. علّمه الفرق بين أن يصلّي أو يتصدّق أمام الناس فقط، وأن يفعل ذلك في الخفاء حيث لا يراه إلا الله. هذه «المراقبة» — أن يستحضر أن الله مطّلعٌ عليه — هي حارسه حين تغيب عنه، وأثمن ما يحميه في زمن المغريات.",
  "try_this": "هذا الأسبوع: شجّع ابنك على «عملٍ سرّيّ» لا يعرفه أحد (صدقة خفية، مساعدة دون أن يُمدح)، وتحدّثا كيف أن الله وحده يراه ويكفيه.",
  "order": 3,
  "estimated_minutes": 8,
  "reflection_prompts": [
    "كيف تعلّم ابنك أن يفعل الخير لله لا لنظرة الناس؟",
    "ما المواقف التي يحتاج فيها ابنك أن يستحضر مراقبة الله في هذه السنّ؟"
  ],
  "warning_flags": [],
  "needs_professional_followup": false,
  "is_published": true,
  "version": "1.0.0",
  "approved_by": null
}
