{
  "id": "lesson_0-3_islamic_parenting_fitrah_02",
  "path_id": "path_0-3_islamic_parenting_fitrah",
  "title": "الدعاء والتحنيك: سنن استقبال المولود",
  "age_group": "0-3",
  "domain": "aqeedah",
  "unit_ids": [],
  "summary": "من هدي النبي ﷺ تحنيك المولود، والدعاء له بالبركة والصلاح، والأذان في أذنه. هذه السنن ليست طقوساً بل أول عقدٍ بين الوالد وربه على هذه الأمانة.",
  "try_this": "هذا الأسبوع: ادعُ لطفلك بدعاءٍ خاصٍّ كل يوم («اللهم اجعله من الصالحين»)، واربط الدعاء بلحظة حملك له.",
  "order": 2,
  "estimated_minutes": 6,
  "reflection_prompts": [
    "ما الدعاء الذي اخترته لطفلك؟",
    "كيف تشعر حين تدعو له؟"
  ],
  "warning_flags": [],
  "needs_professional_followup": false,
  "is_published": true,
  "version": "1.0.0",
  "approved_by": null
}
