{
  "id": "lesson_0-3_medical_infant_sleep_08",
  "path_id": "path_0-3_medical_infant_sleep",
  "title": "سكينة المساء: ذِكرٌ ودعاءٌ بصوتٍ هادئ",
  "age_group": "prenatal-1",
  "domain": "medical",
  "unit_ids": [
    "med-1eb2b059",
    "isl-572e7df3"
  ],
  "summary": "قد يهدأ الرضيع حين تكلّمه بصوتٍ هادئ أو تحمله، ويساعده الروتين المتكرّر للنوم على أن يتعلّم ما ينتظره. ولهذا يحسن أن يكون في آخر روتين المساء صوتٌ هادئٌ مألوف يحمل معنًى طيّبًا: ذِكرٌ لله، ودعاءٌ لرضيعك.\n\nفاحمله أو اجلس بجانب سريره، واقرأ بصوتٍ منخفض ما تحفظه من أذكار المساء والنوم من كتاب أذكارٍ موثوق، أو ما تيسّر لك من القرآن. ثم ادعُ له بكلماتك: أن يحفظه الله ويعافيه ويبارك فيه ويجعله صالحًا؛ فالدعاء للأولاد بالخير والصلاح من حقّهم على والديهم. واحذر أن يسبق لسانك بالدعاء عليه وأنت متعبٌ أو غاضب. ولا يلزم أن يطول ذلك.\n\nوهذه اللحظات ليست لرضيعك وحده، بل لك أنت أيضًا؛ فالليالي الأولى مع الرضيع متعبة، والقلق عليه كثير. وفي القرآن آيةٌ يحسن أن يتذكّرها كل والدٍ متعب. قال تعالى: ﴿أَلَا بِذِكْرِ اللَّهِ تَطْمَئِنُّ الْقُلُوبُ﴾ [سورة الرعد — آية ٢٨] فاجعل هذه اللحظة راحةً لقلبك، كما هي تهدئةٌ لرضيعك.\n\nثم ضعه على ظهره في سريره المستقلّ الخالي في غرفتكم، ولا تغفُ وهو على صدرك أو بين ذراعيك على الأريكة أو الكرسي الوثير. ولا يعني هذا الروتين أن رضيعك سينام الليل كلّه؛ فاستيقاظه ليلًا طبيعيٌّ في شهوره الأولى. ومع التكرار يصير ذكر الله عند النوم عادةً في بيتك يكبر عليها رضيعك. وإذا حاولت إيقاظه فصعب إيقاظه أو لم يستيقظ، أو كان جسمه مرتخيًا على غير عادته، أو صعب تنفّسه أو توقّف، أو ازرقّ لونه أو صار رماديًّا، أو كانت حرارته 38 درجةً مئويةً أو أكثر وعمره أقل من ثلاثة أشهر، أو 39 درجةً أو أكثر وعمره من ثلاثة أشهر إلى ستة، فاطلب الإسعاف أو اذهب إلى الطوارئ فورًا.",
  "try_this": "اليوم: في آخر روتين النوم، اقرأ بصوتٍ منخفض ما تحفظه من أذكار النوم من كتابٍ موثوق، ثم ادعُ لرضيعك دعاءً قصيرًا بكلماتك، ثم ضعه على ظهره في سريره.",
  "order": 8,
  "estimated_minutes": 3,
  "reflection_prompts": [
    "كيف شعرت أنت في لحظات الذكر هذه، وهل لاحظت أثرها على هدوء رضيعك؟"
  ],
  "warning_flags": [],
  "needs_professional_followup": false,
  "is_published": true,
  "version": "1.0.0",
  "created_at": "2026-10-08T07:35:57",
  "updated_at": "2026-10-08T21:00:00",
  "approved_by": null
}
