{
  "id": "lesson_13-15_islamic_parenting_teen_identity_01",
  "path_id": "path_13-15_aqeedah_certainty",
  "title": "الشبهات الدينية: متى يسأل، وكيف يُجيب الوالدان",
  "age_group": "13-15",
  "domain": "aqeedah",
  "unit_ids": [
    "isl-ddf22d9e",
    "isl-1812a28d",
    "isl-199c7aaf"
  ],
  "summary": "في سن 13-15 يبدأ المراهق يسأل: \"لماذا الصلاة؟ لم الحرام؟ هل الله موجود؟\" — هذا ليس تمرداً بل بحث عن يقين. الوالدان: لا تُسكتا السؤال، قولا: \"سؤال ممتاز، لنبحث معاً\". اعرضا أدلة عقلية/قلبية، وارجعا لكتاب/عالم ثقة.",
  "try_this": "هذا الأسبوع: اختاروا شبهة واحدة يرددها ابنكم، ابحثا معاً عن جواب (كتاب/مقطع لعالم ثقة)، ناقشوا: ماذا اقتنعت؟",
  "order": 1,
  "estimated_minutes": 28,
  "reflection_prompts": [
    "ما الشبهة التي طرحها ابنك؟",
    "هل شعر بالاطمئنان بعد النقاش؟"
  ],
  "warning_flags": [
    "إصرار على الإلحاد/الرفض التام للدين",
    "عزلة تامة ورفض الحوار"
  ],
  "needs_professional_followup": true,
  "is_published": true,
  "version": "1.0.0",
  "approved_by": null
}
