{
  "id": "lesson_7-9_medical_emotional_health_b03",
  "path_id": "path_7-9_medical_emotional_health",
  "title": "الخوف والقلق: من الوحوش إلى قلق الواقع",
  "age_group": "7-9",
  "domain": "medical",
  "unit_ids": [
    "seed-fear-79",
    "seed-fear-46",
    "b25fcddc-6765-4e00-9d40-1ac90f97f3b4"
  ],
  "summary": "في هذا العمر تتحوّل مخاوف الطفل من الوحوش إلى قلق أكثر واقعية: الخوف من الفشل، من الاختبار، من فراقك، من المرض. أنصت لمخاوفه دون استهزاء، وساعده على تسميتها والتعبير عنها بالكلمات. صحّح أفكاره المبالغ فيها بمعلومة بسيطة مطمئنة، وعلّمه أدوات للتهدئة (التنفّس العميق، تجزئة المشكلة، التفكير في الأسوأ ثم احتماله الحقيقي). شجّعه على مواجهة المخيف تدريجياً وامدح شجاعته. حافظ على روتين ونوم كافٍ يقلّلان القلق. إذا صار القلق يعطّل نومه أو دراسته أو حياته اليومية لفترة طويلة، فاستشر مختصاً.",
  "try_this": "هذا الأسبوع: حين يخاف طفلك، أنصت وسمِّ خوفه، ثم علّمه نفساً عميقاً واحداً وفكرة مطمئنة واقعية. لاحظ هل بدأ يستخدم الأداة وحده.",
  "order": 3,
  "estimated_minutes": 5,
  "reflection_prompts": [
    "ما المخاوف الواقعية التي بدأت تظهر عند طفلك في هذا العمر؟",
    "كيف تطمئنه دون أن تستهين بخوفه أو تبالغ في حمايته منه؟"
  ],
  "warning_flags": [],
  "is_published": true,
  "version": "1.0.0",
  "created_at": "2026-06-13T00:00:00",
  "updated_at": "2026-06-13T00:00:00",
  "approved_by": null
}
