{
  "id": "lesson_7-9_aqeedah_fundamentals_07",
  "path_id": "path_7-9_aqeedah_fundamentals",
  "title": "Muhammad ﷺ Our Role Model",
  "age_group": "7-9",
  "domain": "aqeedah",
  "unit_ids": [
    "aqe-c078677c"
  ],
  "summary": "Belief in the messengers is one of the pillars of iman, and the seal of them all and the beloved of them to our hearts is our Prophet Muhammad ﷺ. Introduce your child to the Prophet ﷺ as a living, beloved role model, not just a name to be mentioned: he was truthful and trustworthy, so much so that his people called him 'Al-Sadiq Al-Amin' (The Truthful, The Trustworthy). He was merciful to children, kissing and playing with them, and gentle to the weak and even animals. Tell your child short stories from his seerah, and teach him to say 'salla Allahu alayhi wa sallam' whenever his name is mentioned, and that following him is by his akhlaq before speech. When a child loves the Prophet, it becomes easy for him to follow his example.",
  "try_this": "This week: Tell your child a short story every night about the mercy of the Prophet ﷺ, then ask him, 'How can we be like him tomorrow?' Let him choose a character trait to apply.",
  "order": 7,
  "estimated_minutes": 8,
  "reflection_prompts": [
    "How can you convey to your child the love of the Prophet ﷺ as a living role model, not just a name to be memorized?",
    "Which Prophetic character trait do you most wish your child to embody first, and how does he see it in you?"
  ],
  "warning_flags": [],
  "needs_professional_followup": false,
  "is_published": true,
  "version": "1.0.0",
  "approved_by": "auto-review:deepseek-v4-pro+glm-5.2:2026-10-04",
  "language": "en",
  "source_language": "ar",
  "translation": {
    "translator_model": "mistral-large-3:675b",
    "reviewer_model": "deepseek-v4-pro+glm-5.2",
    "needs_scholar_review": true,
    "scholar_signals": {
      "keyword": true,
      "quoted_arabic": true,
      "reviewer_model": false
    },
    "review_verdict": "clean",
    "review_defects": [],
    "approved_by": "auto-review:deepseek-v4-pro+glm-5.2:2026-10-04",
    "revalidated_at": "2026-10-04T16:52:31+00:00",
    "fixed_at": "2026-08-13T19:04:55.485691+00:00",
    "fixer_model": "mistral-large-3:675b",
    "auto_review": {
      "reviewers": [
        "deepseek-v4-pro",
        "glm-5.2"
      ],
      "fixer": null,
      "rounds": 1,
      "prompt_version": "dfa8a5f39718",
      "content_sha256": "4b640e06a54d6c954491ef55bb1712fa9773d0fa32cc88e11476faabaf4c0f2e",
      "reviewed_at": "2026-10-04T16:52:31+00:00",
      "residual_low": [],
      "adjudicated": [],
      "tool": "ops/tools/review_en_parity.py",
      "meaning": "deterministic guards passed and two different-family model reviewers found no medium/high defect in this exact text; not a scholar's ijazah"
    }
  }
}
