{
  "id": "lesson_2-3_development_tantrums_04",
  "path_id": "path_2-3_development_tantrums",
  "title": "بعد أن يهدأ: الحضن أولًا ثم الكلمات",
  "age_group": "2-3",
  "domain": "development",
  "unit_ids": [
    "seed-tantrum-23",
    "dev-35865ddb"
  ],
  "summary": "انتهت النوبة، وهدأ طفلك. الآن صار قادرًا على أن يسمعك، وهذا وقتٌ مناسب ليتعلّم شيئًا عن مشاعره. لكن تأكّد أنك هدأت أنت أيضًا؛ فإن كنت لا تزال منفعلًا، فخذ أنفاسًا عميقة أولًا، ثم اقترب منه.\n\nابدأ بالقرب قبل الكلام: احضنه إن أراد، أو امسح على ظهره بلطف، أو انظر في عينيه وابتسم له. فهذا يطمئنه أنك ما زلت قريبًا منه بعد غضبه. ثم سمِّ شعوره بكلماتٍ بسيطة: «كنتَ غاضبًا لأن البرج وقع». وإن لم تعرف شعوره بالضبط فقل: «يبدو أن شيئًا أزعجك». وإن صحّحك، فكرّر كلامه وزِده كلمة. فبهذا يتعلّم أنّ لمشاعره أسماءً، وأنه يستطيع أن يقولها بدل أن يصرخ بها.\n\nثم ضع الحدّ بهدوء ودون محاضرة: «لا بأس أن تغضب، لكن لا نرمي المكعبات». واقترح بديلًا بسيطًا: «هل نبني البرج من جديد، أم نلعب بالأحجية؟». وعلّمه طريقةً مقبولة يعبّر بها عن ضيقه، كأن يقول: «أنا غاضب»، أو يطلب منك المساعدة. ولا تتعجّل الحلول قبل أن يشعر أنك فهمته؛ فالتعجّل قد يُشعره أن مشاعره لا تهمّك، فيزيد انفعاله.\n\nوإن ضرب أحدًا أثناء النوبة، فقل له بهدوءٍ ووضوح: «الضرب يؤذي، ولن أسمح به»، ولا تضربه أنت لتعلّمه؛ فهذا يعلّمه أن الضرب مقبول. ولا تُخجله ولا تُعيّره بما حدث، بل عُد إلى يومك معه بلطف، وأثنِ عليه حين تراه يعبّر عن غضبه بكلمة أو يطلب المساعدة.\n\nوتحدّث مع طبيب الأطفال إن كانت النوبات كثيرةً جدًّا أو أطول ممّا يُتوقّع في عمره، أو كان لا يستطيع أن يهدأ، أو يؤذي نفسه أو غيره، أو كانت تعطّل حياته اليومية، أو فقد مهاراتٍ كان يتقنها، أو بدا حزينًا أو منسحبًا أو كثيرَ المطالب لا يرضى في أغلب الأوقات. وإن حدثت إصابةٌ خطيرة أو لم تستطع الحفاظ على سلامته، فاطلب مساعدةً عاجلة فورًا.",
  "try_this": "اليوم: بعد أول لحظة غضبٍ أو بكاءٍ عند طفلك، وحين تهدأ أنت وطفلك، اقترب منه بحضنٍ أو لمسةٍ لطيفة إن أرادها، ثم قل جملةً واحدة تسمّي شعوره، مثل: «كنتَ حزينًا لأن اللعبة انكسرت».",
  "order": 4,
  "estimated_minutes": 3,
  "reflection_prompts": [
    "كيف استجاب طفلك حين سمّيت شعوره بعد أن هدأ، وهل بدأ يستعمل كلمةً من كلماتك؟"
  ],
  "warning_flags": [],
  "needs_professional_followup": false,
  "is_published": true,
  "version": "1.0.0",
  "created_at": "2026-10-08T08:03:33",
  "updated_at": "2026-10-08T08:03:33",
  "approved_by": null
}
